image_name,pair_id,caption
train/image/051015.jpg,4036,"behind the person is a refrigerator, and also a dining table with magenta-backed chairs."
train/image/013626.jpg,1096,a pink purse sits near a chair in front of a person.
train/image/158230.jpg,12402,a building with storefronts is behind a person on a brick walkway.
train/image/149262.jpg,11707,there's a pink and beige blanketed bed in the room where a person stands.
train/image/075631.jpg,5971,a person stands in front of a door with a suitcase beside it.
train/image/088781.jpg,7013,the person stands by a deck with lattice fencing that holds flower pots.
train/image/158219.jpg,12402,in a bathroom a person stands in front of a shower.
train/image/114099.jpg,9035,a bed with things piled on it is behind a person.
train/image/171292.jpg,13417,"the person stands in front of a light colored wood desk, on top of which is a laptop."
train/image/037554.jpg,2946,"a parked motorbike, bushes, a large brick building, and a brick wall are behind the person."
train/image/048131.jpg,3808,a person stands facing a blue door.
train/image/092865.jpg,7330,a person stands in a well lit stairwell.
train/image/089828.jpg,7096,a green lamp sits on a desk next to a standing person.
train/image/143048.jpg,11222,a cartoon cat with a speech bubble is next to the posing person.
train/image/013631.jpg,1096,a person poses next to many green bushes and trees.
train/image/049482.jpg,3926,a person is standing in front of a wall with large pictures on it.
train/image/167806.jpg,13158,the person stands in a store filled with backpacks and purses.
train/image/182869.jpg,14346,"a person sits on a soccer field, next to the end line."
train/image/017652.jpg,1403,a person leans against a white countertop.
train/image/176031.jpg,13796,a person is fixing their hair while standing and watching tv.
train/image/075617.jpg,5971,a person stands on astroturf.
train/image/047230.jpg,3731,a person standing in her room.
train/image/074029.jpg,5841,a person clasps their purse while standing on the edge of a stair.
train/image/037483.jpg,2938,"the person stands on a long wooden pier over water, facing mountains."
train/image/140038.jpg,11013,behind the person are pictures on a wall and a small white table.
train/image/176028.jpg,13796,"standing on a two-toned striped carpeting, a person is facing a tv."
train/image/089188.jpg,7044,a person walks along the beach on a bright day.
train/image/124850.jpg,9867,a person stands in front of a wall with many pink flowers.
train/image/030612.jpg,2416,a person standing by an open window that has security bars on it.
train/image/171273.jpg,13417,a beige corner sofa and white coffee table are behind the person.
train/image/019508.jpg,1541,showing the peace sign with the fingers on the left hand. a person is posing by a window.
train/image/073867.jpg,5833,a white satin curtain hangs over a rail in front of a person.
train/image/003837.jpg,309,a desk with an item leaning in the space below it is behind the person.
train/image/032985.jpg,2594,a person leans against a plain white wall.
train/image/073880.jpg,5833,a person stands in front of a ladder in front of some cupboards.
train/image/019502.jpg,1541,tall buildings are the backdrop as the person stands on a wooden walkway.
train/image/164962.jpg,12915,a person is standing in front of a car and a tree.
train/image/149392.jpg,11716,"between two small trees, a person is posing."
train/image/037573.jpg,2946,a person stands in an outdoor area with a black reclining chair.
train/image/099541.jpg,7884,"a shelf of books, a desk holding a mouse character and a small wastebin are behind the person."
train/image/053439.jpg,4224,lights reflect off glass walls behind a person that is walking.
train/image/160030.jpg,12528,a person stands in front of shelves with grocery products on them.
train/image/107755.jpg,8529,a person sits on a thin striped carpet
train/image/012294.jpg,993,a person is standing on a green tile of a multi-colored floor covering.
train/image/006887.jpg,564,a person stands in front of a bed with a bright green blanket on it.
train/image/069606.jpg,5513,a black door and black wall shelves are behind the person.
train/image/081386.jpg,6425,a person poses in front of a bed with a flowered bedspread.
train/image/048135.jpg,3808,a tall plant is near an easel behind a posing person.
train/image/002652.jpg,221,"the room where a person stands has a white table with a cloth on top, and has white walls."
train/image/083577.jpg,6588,a person poses in a room with an umbrella in it.
train/image/006885.jpg,564,a lime green bed stands behind a person posing.
train/image/072623.jpg,5740,a person stands in front of a curtained shelf on gray carpet.
train/image/030624.jpg,2416,a tan coffee table with containers on it is behind a posing person.
train/image/143108.jpg,11227,the person faces a corner where a water cooler stands under a picture.
train/image/051010.jpg,4036,the person poses with one knee on the edge of a bed in a room with a window.
train/image/032979.jpg,2594,weathered buildings stand on either side of the person.
train/image/149405.jpg,11716,"in front of a huge boulder, a person is standing."
train/image/095056.jpg,7508,"on a running track, a person is sitting between the #4 and #5."
train/image/109767.jpg,8691,a jacket hangs beath luggage behind the posing person.
train/image/092871.jpg,7330,a person is posing against a small space of wall between two wooden doors.
train/image/134535.jpg,10613,a red car with a person leaning on it is near a metal fence.
train/image/011149.jpg,885,two dining chairs stand behind a posing person.
train/image/007246.jpg,588,"on a concrete road, a person is facing towards a tall fence and kicking their left leg forward."
train/image/140059.jpg,11013,a blue sofa is behind the standing person.
train/image/141802.jpg,11132,a wall with diagonal tiles is behind a person that is posing.
train/image/123364.jpg,9749,in front of a medicine cabinet a person is standing.
train/image/047447.jpg,3747,the person is facing a black leather loveseat with a portrait above it.
train/image/089196.jpg,7044,"in the corner of the room in front of a wooden door, the person poses with hand on hip."
train/image/051050.jpg,4037,a green hedge in front of a brick wall is behind the person.
train/image/008417.jpg,683,a person is standing in an excercise room.
train/image/066482.jpg,5262,a person is posing in front of a white staircase railing.
train/image/003847.jpg,309,a person is kneeling in front of a night stand.
train/image/167804.jpg,13158,backpacks are stacked behind the posing person.
train/image/072624.jpg,5740,a person stands beside a bunkbed with a ladder on the side.
train/image/051019.jpg,4036,"a person, standing at an angle, is posing in front of furniture covered in a white cloth"
train/image/012153.jpg,978,a blue yoga mat and hoop are along the wall that the person faces.
train/image/183261.jpg,14376,in front of a field of bamboo stands a person.
train/image/053441.jpg,4224,a person is facing towards a white wall and a short red stool.
train/image/053697.jpg,4238,a colorful mural is on the wall next to where the person walks on honeycomb-like tiles.
train/image/066481.jpg,5262,"a person is posing beside a tall, dark chair embellished by a portrait."
train/image/043386.jpg,3430,the foliage is very lush on either side of a person walking on a stone walkway.
train/image/014716.jpg,1181,a purple towel hangs behind the person posing in front of a vanity.
train/image/005619.jpg,452,a beach with whitecapped waves is in front of the person.
train/image/019947.jpg,1576,a person stands on white linoleum squares in a room.
train/image/008222.jpg,669,the person stands in a corner by a wooden door and in front of a wall-mounted appliance.
train/image/019504.jpg,1541,the person stands on a wooden deck in front of a park-like area with a bench.
train/image/092866.jpg,7330,a person poses in front of a set of stairs with a blue bucket next to it
train/image/089191.jpg,7044,the person stands by a wall of storage lockers.
train/image/122435.jpg,9678,the floor of the room where a person is standing is half wood flooring and the other half is tiled.
train/image/011130.jpg,885,the person is walking past outdoor seating and a parked car.
train/image/164963.jpg,12915,a person poses in a white carpeted room.
train/image/149143.jpg,11700,a red curtain hangs behind the posing person.
train/image/149389.jpg,11716,"it is quite sunny, and the foliage looks lush while the person walks on the trim of a sidewalk."
train/image/049479.jpg,3926,a large display screen hangs above black cabinets behind the person.
train/image/047435.jpg,3747,a fan blowing behind a person standing on a green carpet.
train/image/079648.jpg,6282,"a recessed window is on the wall next to the person, who faces a framed floral picture."
train/image/143121.jpg,11227,on an overpass at night stands a person.
train/image/017638.jpg,1403,a person poses in front of a white vanity with makeup brushes and a round case on it.
train/image/047226.jpg,3731,a person is standing in the aisle of a grocery store.
train/image/120250.jpg,9519,a cabinet with a pale blue purse on top is behind the person.
train/image/034162.jpg,2684,the person faces a wall with stacks of boxes on a shelf in the corner.
train/image/083849.jpg,6615,"in her room, a person is standing in front of shelves."
train/image/043391.jpg,3430,the person stands on a cement path surrounded by trees.
train/image/180269.jpg,14124,the person stands in the middle of a white-walled room that includes cabinets and a floor fan.
train/image/182867.jpg,14346,a person is sitting in a small chair in front of a short desk that is holding a computer.
train/image/143039.jpg,11222,a person stands in a bathroom with several colorful towels.
train/image/149258.jpg,11707,there are pink slippers strewn about in the floor where a person is standing.
train/image/084502.jpg,6668,a fan on a floor stand is behind the posing person.
train/image/051006.jpg,4036,red pillows are on a white bed behind a posing person.
train/image/140031.jpg,11013,"there is a person standing near a wooden desk, beneath a bunkbed."
train/image/012344.jpg,996,a person stands in front of a bed with a pink blanket on it.
train/image/075630.jpg,5971,a large building with colored grids on the ground in front of it is this person's backdrop.
train/image/053437.jpg,4224,beige floral wallpaper and a wooden door are behind the person.
train/image/140053.jpg,11013,"in the park, a person holding her cap over her face."
train/image/127486.jpg,10071,the person is surrounded by colorful cartoon images and text.
train/image/127494.jpg,10071,"in a room with white floors, a person poses next to a pink and green basket."
train/image/134533.jpg,10613,the person stands in front of bunkbeds.
train/image/047453.jpg,3747,a black loveseat with a portrait above it is behind the posing person.
train/image/046823.jpg,3694,there's another pair of shoes by the feet of the person standing in the bathroom.
train/image/053699.jpg,4238,the person stands in a room between two ladders.
train/image/053686.jpg,4238,a white wardrobe stands behind a person standing
train/image/051042.jpg,4037,"in the center of the room, a person is standing on left leg with right one bent behind them."
train/image/127630.jpg,10080,"a brown tote hangs behind the posing person, and colored bowls are in the foreground."
train/image/167803.jpg,13158,"there are towels on hangers above the person, who stands in front of a bathroom sink."
train/image/185733.jpg,14582,"on the floor by the person there is a step stool with yellow legs, and an orange waste basket."
train/image/047234.jpg,3731,a bed with a red pillow and bedspread is behind the person.
train/image/056635.jpg,4481,rows of shoes on white shelving are behind the person.
train/image/006526.jpg,532,trashcans and a mop are on the floor along a wall behind the person.
train/image/043375.jpg,3430,"with a backdrop of tropical foliage, a person is standing at the rail of a narrow deck."
train/image/095069.jpg,7508,the person stands on a curving brick path flanked by trees.
train/image/160036.jpg,12528,"inside of a storeroom, a person poses next to fully stocked shelves."
train/image/149257.jpg,11707,"a person grabs their clothing as if to curtsy, in a room thats half beige and half white."
train/image/003857.jpg,309,a person walks down a light colored road in front of some mountains.
train/image/046824.jpg,3694,a watercooler with a white base is behind the person.
train/image/149159.jpg,11700,"the painting and the brown door are behind the person holding up ""peace"" hand gestures."
train/image/085118.jpg,6710,"the person stands on faux wood flooring, and in front of a bed, a white bedside table, and a stool."
train/image/053327.jpg,4217,the person stands in front of railing which overlooks a courtyard.
train/image/083855.jpg,6615,a person leans on a wall with rows of round lights going around it.
train/image/046827.jpg,3694,the person poses in a shop with white bathroom fixtures and red heart decorations.
train/image/034164.jpg,2684,"in an outside garden, a person is standing it the dirt between two rows of plants."
train/image/182861.jpg,14346,"behind the person is a white brick wall with stacked boxes, a framed picture and a dress form by it."
train/image/122437.jpg,9678,a bathroom counter filled with various glass jars has a person standing in front of it.
train/image/141790.jpg,11132,the person sits on a red couch in front of a table with a red cloth.
train/image/027383.jpg,2164,a portrait of a person and a water bottle are near the posing person.
train/image/012293.jpg,993,a person stands on a tiled balcony which has vivid blue walls.
train/image/139732.jpg,10993,"in a bedroom, a person is standing sideways i front of a twin bed."
train/image/079649.jpg,6282,a person stands in the middle of a field of flowers with trees in the background.
train/image/007252.jpg,588,the person stands in front of a long lavender curtain with a scalloped edge.
train/image/042165.jpg,3332,the person faces outward while standing at a white counter in front of packed shelves.
train/image/185734.jpg,14582,a small stoll and orange bucket are on the floor by the open doorway where the person stands.
train/image/132869.jpg,10488,the person stands in front of a refrigerator and next to a television screen.
train/image/074011.jpg,5841,the person is facing the side of a red car.
train/image/051001.jpg,4036,a green door with many posted items stands behind a person posing.
train/image/053329.jpg,4217,the person stands on a railed balcony overlooking a courtyard.
train/image/132884.jpg,10488,the wall behind the standing person is made of brick and has two cutouts exposing foliage.
train/image/092873.jpg,7330,a person is standing between two doors.
train/image/037569.jpg,2946,a person is sitting on a sheet on a bed with the arms circling their knees
train/image/074027.jpg,5841,a wall painted with a tree and pink lips forms the person's backdrop.
train/image/179780.jpg,14092,the person faces white doors with purple ribbons on their handles.
train/image/149390.jpg,11716,a person poses while standing on a stone pathway.
train/image/081955.jpg,6471,a spa counter has red characters on it behind a person standing
train/image/158211.jpg,12402,two wooden poles and pigeons on the ground are behind the person.
train/image/081384.jpg,6425,the person is standing on a ledge in front of a glass shop window.
train/image/051041.jpg,4037,a person poses on a bridge above a body of water.
train/image/072636.jpg,5740,the person reaches a hand up to their face as they overlook a child's bed.
train/image/007251.jpg,588,the person stands with bent leg in front of a picture hung on the wall.
train/image/079651.jpg,6282,"a person stands near a curved, tiled bar."
train/image/088772.jpg,7013,a person leans on the back of a park bench on a sunny day.
train/image/074025.jpg,5841,a person stands in a room full of chairs and desks with colorful decals on the wall.
train/image/013909.jpg,1115,"in front of a painting, a person is posing."
train/image/051056.jpg,4037,a person sits on a bull in the middle of a field.
train/image/148817.jpg,11674,a person poses on a bridge with lush trees behind it.
train/image/149398.jpg,11716,"the person stands under and umbrella behind a bench, with playground equipment in the background."
train/image/037556.jpg,2946,an inset shelf holding lotion bottles and hanging drab cloths are near the person.
train/image/053442.jpg,4224,a person is standing on a wooden deck looking at a huge wooden wheel.
train/image/143099.jpg,11227,a sink and a counter stands in front of a person with a hand on their hip.
train/image/075616.jpg,5971,"a person posing in the courtyard in front of a historic-looking, multi-story building."
train/image/109773.jpg,8691,a wall decorated with decals is beside the standing person.
train/image/158216.jpg,12402,a person is standing in front of a bathroom shower.
train/image/030631.jpg,2416,a person is posing next to a black ladder and a pink fire hydrant.
train/image/164948.jpg,12915,the walls behind the person illustrate colorful drawn characters walking up stairs.
train/image/019961.jpg,1576,shadows fall across a wood floor in a room with a four post bed where a person stands.
train/image/143034.jpg,11222,a plant with large green leaves is behind the person.
train/image/013907.jpg,1115,a person stands next to a wall with a picture of a house drawn on it.
train/image/164967.jpg,12915,a person is posing on a shiny black floor.
train/image/052155.jpg,4128,a green vending machine is next to the person and red chairs are in the background.
train/image/008416.jpg,683,the person facing the other way is in front of a wall with a blurry image.
train/image/123353.jpg,9749,the person stands by a black stool in front of a wall with an arrow sign on it.
train/image/066478.jpg,5262,a curtain printed with red cherries is the posing person's backdrop.
train/image/095063.jpg,7508,"on green grass, a person is sitting in the middle of a white outlined triangle."
train/image/053433.jpg,4224,water bottles are on the floor and posters on the walls behind the person.
train/image/180268.jpg,14124,the person stands on a floor that holds pairs of shoes and a fan.
train/image/027374.jpg,2164,a well lit room has a pink bed behind a person posing.
train/image/074012.jpg,5841,"a wooden desk, chair and stool are behind the person."
train/image/073871.jpg,5833,there are hula hoops against the wall in the room where the person stands.
train/image/046825.jpg,3694,a tall mountain range stretches behind a posing person
train/image/008402.jpg,683,a sink has cleaning products next to it with a person standing in front.
train/image/002648.jpg,221,there is a shoe rack next to the tan wall where a person stands.
train/image/164965.jpg,12915,a person sits on a set of grey stone steps.
train/image/092867.jpg,7330,on a sidewalk lines with bushes stands a person.
train/image/095059.jpg,7508,"shelves of bottles and other items are behind the person, and a blue bottle is on the floor."
train/image/073869.jpg,5833,a person is standing in front of a curtain.
train/image/037558.jpg,2946,the water in a river rushes by as a person steps from rock to rock.
train/image/158171.jpg,12398,"in a bedroom, the person is facing a white bunk bed."
train/image/034163.jpg,2684,the person stands on a floor with a blue stool on one side and white cabinets on the other.
train/image/030616.jpg,2416,the light shines brightly through a window behind a person standing.
train/image/053448.jpg,4224,"under a beamed ceiling of  a tall room, a person is posing in front of a glass railing."
train/image/080667.jpg,6363,a person leans on a tall wardrobe in front of a white wall.
train/image/158175.jpg,12398,a person stands on a multi-toned tan floor near a bright window.
train/image/132875.jpg,10488,a person covers their face in a room with many knick-knacks.
train/image/079644.jpg,6282,large yellow leaves frame the person who is posing.
train/image/122443.jpg,9678,a person trying on new clothes.
train/image/143116.jpg,11227,the person stands in the middle of a green field facing a row of trees.
train/image/114214.jpg,9040,the person stands in an open doorway by a tall pale wood panel.
train/image/114213.jpg,9040,a person poses in front of yellow curtains.
train/image/139730.jpg,10993,"the person stands by a small plate on a brick-like floor, with a red chair in the background."
train/image/134546.jpg,10613,a tall brown chair sits on a floor behind a person.
train/image/030626.jpg,2416,"the person stands in a room in front of stacked items, with a window alongside."
train/image/012306.jpg,993,a chair with a floral cloth on it is beside a person.
train/image/013633.jpg,1096,"holding a bouquet, the person stands on a crosswalk in front of a parking lot."
train/image/099523.jpg,7884,a person stands in front of a door that has tan bands going across it.
train/image/073887.jpg,5833,"outside by a lake, a person stands by a metal railing."
train/image/182874.jpg,14346,next to a soccer net stands a person.
train/image/122432.jpg,9678,the white wall in front of a person is bare aside from minimal light brown shelving.
train/image/007244.jpg,588,on a sunny day a person walks in front of a row of trees.
train/image/124854.jpg,9867,a person stands next to hanging coats in front of an open door.
train/image/164951.jpg,12915,the person poses by a wall covered in green foliage.
train/image/056644.jpg,4481,a salon chair has a person sitting in it.
train/image/073888.jpg,5833,a person stands in front of a gray painted door with a hanger on it.
train/image/007254.jpg,588,a person stands on a street that has houses on either side.
train/image/182866.jpg,14346,a person stands in front of a small black swivel chair.
train/image/053316.jpg,4217,a person stands in front of a large lit building at night.
train/image/072631.jpg,5740,"outside in a wooded area, a person is posing against a tall tree."
train/image/083848.jpg,6615,a black wall with pictures on it is in front of a person.
train/image/122439.jpg,9678,the person stands between a watercooler and a rug that holds a table.
train/image/078692.jpg,6212,a person stands in front of a sofa with a suitcase beside it.
train/image/149399.jpg,11716,the person stands on grass facing a large tree.
train/image/072638.jpg,5740,two blue rolling luggage items and multiple trees are behind the person.
train/image/124860.jpg,9867,a person stands in front of a toilet in a bathroom.
train/image/075633.jpg,5971,"the person faces posters on a wall, and a blue stool is on the floor."
train/image/042148.jpg,3332,a person stands in front of a light brown cabinet.
train/image/049467.jpg,3926,a person walks along a brick walkway on a sunny day.
train/image/141809.jpg,11132,the person is facing an arcade game with a small stool in front of it.
train/image/051046.jpg,4037,a boulder under a tree has a person leaning on it.
train/image/095072.jpg,7508,an open sliding door with a person standing in front of it.
train/image/083858.jpg,6615,several plastic buckets line the floor behind a person standing on white tile.
train/image/109774.jpg,8691,the person stands on a stone walkway between grassy areas.
train/image/003839.jpg,309,a forkful of food is lifted to the lips of a person sitting at a table.
train/image/051002.jpg,4036,"on a white tile floor, a person is standing in front of a white piece of furniture."
train/image/080673.jpg,6363,the pink wardrobe is zipped closed in the room where a person is standing.
train/image/141806.jpg,11132,"in a bedroom, a person is standing a the bottom corner of a bed that has a pink bedspread."
train/image/190013.jpg,14923,the person faces a storage locker where clothes hang.
train/image/051004.jpg,4036,"a person stands next to an off-white wall, on white talls, and in front of a dark brown door."
train/image/179785.jpg,14092,a chair draped with cloth items is next to the person.
train/image/118437.jpg,9376,a bed is on a brown wood floor behind a person.
train/image/124853.jpg,9867,a person poses in front of a vase of flowers and a vanity table.
train/image/012352.jpg,996,a person poses behind some leaves in a yard with a fence.
train/image/139720.jpg,10993,the person faces floor-length sheer pink curtains.
train/image/012141.jpg,978,a chair holding a dark item is behind the person.
train/image/012143.jpg,978,the person stands posing in an open doorway by a beige wall.
train/image/176037.jpg,13796,the person stands in front of a large white cabinet.
train/image/089835.jpg,7096,"in a store, the person poses next to a display of flowers."
train/image/088762.jpg,7013,"trees are behind the person, who faces a wooden structure."
train/image/037571.jpg,2946,the person stands next to dark chairs and desks.
train/image/171274.jpg,13417,a person is standing in a room taking a picture of herself.
train/image/008410.jpg,683,a person standing on a white floor with their hand raised flashing the peace sign.
train/image/012339.jpg,996,a person stands in front of towels hanging on a rack.
train/image/021854.jpg,1735,"the person faces a brown dresser, which is next to a brown door."
train/image/056640.jpg,4481,"dark doors, steps and a table and chairs are behind the person."
train/image/127634.jpg,10080,the person stands in front of white storage cabinets.
train/image/149403.jpg,11716,"in an outdoor flowery field, a person has both arms outstretched in enjoyment and happiness."
train/image/158212.jpg,12402,"the person stands in front of curtains, which hang above items stacked on the floor."
train/image/158224.jpg,12402,a square bricked street lies below a person walking.
train/image/027378.jpg,2164,the person stands by a white balcony wall of a multi-story building.
train/image/079662.jpg,6282,"a person walked on a white, black, and red brick walkway."
