image_name,pair_id,caption
train/image/072634.jpg,5740,the person walks toward a bench on a path flanked by a hedge.
train/image/158222.jpg,12402,the person poses in front of a sheer curtain and next to a blue stool.
train/image/003838.jpg,309,a person having shorts on.
train/image/124865.jpg,9867,"it is a sunny day in this city, the streets are relatively quiet as the person pulls at their hair."
train/image/007241.jpg,588,"standing on concrete with a concrete wall behind them, a person has both hands on their face."
train/image/005005.jpg,399,a restaurant where a person sits has red chairs and white tablecloths.
train/image/034180.jpg,2684,a white rope hands out of the wooden drawers in the room where a person stands.
train/image/122436.jpg,9678,a pillow with a diamond pattern is next to the person's hand.
train/image/149157.jpg,11700,the person faces a neat white vanity and stool.
train/image/182871.jpg,14346,"a blue wardrobe, an open door and a bed are behind the person."
train/image/007250.jpg,588,the person stands on a decorative brick surface with foliage in the background.
train/image/021855.jpg,1735,a person stands just behind a brown door with something hanging on it.
train/image/030625.jpg,2416,a person stands beside a small tan table with black legs.
train/image/079653.jpg,6282,the person poses on a paved road flanked by neatly spaced trees.
train/image/088760.jpg,7013,the person walks on a brick road bordered by a low wall and trees.
train/image/048137.jpg,3808,a person stands in front of a long yellow screen with a picture of fruit on it.
train/image/160031.jpg,12528,shelves full of beverages and other packaged items are behind the person.
train/image/066489.jpg,5262,a white bookcase with many trinkets on display stands behind a person posing.
train/image/053431.jpg,4224,the person sits on a black chair by a wall with pale stripes.
train/image/051058.jpg,4037,"underneath a rainbow arc of bicycles, a person gestures with the peace sign."
train/image/037568.jpg,2946,a person stands behind a silver box and a small wooden counter.
train/image/053679.jpg,4238,there are many harps in the background of a room where a person stands facing sideways.
train/image/069587.jpg,5513,a microphone stand is held by a person singing in a brightly lit corner.
train/image/127490.jpg,10071,"standing in front of a stairway, a person is posing."
train/image/012142.jpg,978,a table with a red and blue bag hanging near it is behind a person.
train/image/089840.jpg,7096,"a person smiles, behind them there is a hand-painted mural of flowers."
train/image/027390.jpg,2164,the person stands looking out while leaning on a railing by a white building.
train/image/069591.jpg,5513,a person poses in the kitchen of a small apartment.
train/image/052176.jpg,4128,a display wall of shoes stands behind the person.
train/image/080669.jpg,6363,there is a purple chair directly in front of a person.
train/image/179792.jpg,14092,a person stands indoors between a window and a water cooler.
train/image/080672.jpg,6363,a person stands in front of another person near a tan brick wall with deep groove marks.
train/image/088775.jpg,7013,pretty pink and silver curtans flank the posing person.
train/image/006535.jpg,532,"the studio where the person stands, hands behind their back, is purple."
train/image/127618.jpg,10080,"several black office chairs surround the person, including one chair with a red animal-faced item on"
train/image/149395.jpg,11716,a person stands in front of a stone wall covered in green ivy.
train/image/004993.jpg,399,the person stands beside a white closet door that is partly ajar.
train/image/149146.jpg,11700,"there is a green box in front of a person, and next to a brown wall."
train/image/043379.jpg,3430,a person poses while standing on a black marble floor.
train/image/176014.jpg,13796,a person is standing in front of a tv.
train/image/081381.jpg,6425,a person stands in front of a red chair with a large teddy bear in it.
train/image/003846.jpg,309,a sliding door with black trim is beside a person standing on a tan floor.
train/image/107748.jpg,8529,a flower patterned curtain hangs next to a person posing.
train/image/056649.jpg,4481,on a grey brick road a person is walking outside.
train/image/148828.jpg,11674,a person is posing on a long sidewalk in front of a long building that has many doors.
train/image/005611.jpg,452,the person stands on a rocky bank by a body of water surrounded by greenery.
train/image/114215.jpg,9040,a person poses in front of yellow curtains with polka dots on them.
train/image/190014.jpg,14923,"white cabinets, some with open drawers, are alongside and behind the person."
train/image/008408.jpg,683,the person stands in front of a rectangular cabinet and a dark wooden door.
train/image/139722.jpg,10993,an oval rock garden is behind the posing person.
train/image/034599.jpg,2723,bright windows and beds with colorful spreads are behind the person.
train/image/095050.jpg,7508,"by a winding sidewalk, a person is sitting on a square concrete pedestal."
train/image/141811.jpg,11132,a person stands in front of a glass case with items in it.
train/image/083866.jpg,6615,a person poses in front of a light brown restaurant cabinet.
train/image/069600.jpg,5513,a person leans over a fence on a dark brick walkway.
train/image/167807.jpg,13158,a person stands with crossed arms in front of red curtains.
train/image/180262.jpg,14124,there's a gold phone on the glass table in the room where a person stands.
train/image/189502.jpg,14881,"in a living room, a person is standing."
train/image/005615.jpg,452,a large stuffed animal sits by a green pillow on a pink seat behind the person.
train/image/011135.jpg,885,"in a shoes store, a person is posing in front of a wall of shoes."
train/image/037563.jpg,2946,a person has a hand on a chair in a bedroom.
train/image/123361.jpg,9749,there are food vendors behind a person.
train/image/171276.jpg,13417,the floor is tiled beneath a person standing in a room with bunkeds and wooden furniture.
train/image/034606.jpg,2723,a person poses in front of a storage chest with brown doors.
train/image/149256.jpg,11707,a person looking up at the camera.
train/image/053430.jpg,4224,a person leans backwards slightly in front of a brown door.
train/image/053313.jpg,4217,outside at night a person looks over a balcony at another building.
train/image/012356.jpg,996,on a sidewalk at night stands a person by the road.
train/image/077368.jpg,6103,a person stands in front of a row of small motorcycles.
train/image/077373.jpg,6103,a white wooden door is directly behind the standing person.
train/image/149400.jpg,11716,a person walks along a tree lined walkway in front of a building.
train/image/149273.jpg,11707,a white door is open in front of a person.
train/image/149269.jpg,11707,behind the person are an open clothing storage unit and a tall brown cabinet.
train/image/011137.jpg,885,the person holds the handle of an umbrella.
train/image/143117.jpg,11227,the person sits on a rock ledge facing a mountain.
train/image/037584.jpg,2946,a white shelf with a blue box of items is behind a person.
train/image/075618.jpg,5971,a person poses in a room with flowered wallpaper.
train/image/030618.jpg,2416,a pair of white windows flank the standing person.
train/image/114218.jpg,9040,a purple bowl is on the floor near a person in front of a table.
train/image/007245.jpg,588,"on an outdoor path, a person is walking under the fronds of palm trees."
train/image/182865.jpg,14346,"in a park, a person is having fun."
train/image/003844.jpg,309,the person stands on a grid in a cement road bordered by greenery.
train/image/085115.jpg,6710,a city street with cars and buildings is behind the person.
train/image/034159.jpg,2684,animals are in a pen behind a fence the person stands outside of.
train/image/037565.jpg,2946,the person stands beside a chair pushed up to a desk.
train/image/134532.jpg,10613,the person poses in front of a statue of an athlete surrounded by white railing.
train/image/019941.jpg,1576,a dimly lit hallway stretches behind a standing person.
train/image/037461.jpg,2938,"a person has their hands on their hips, while a person behind them faces the other way."
train/image/070355.jpg,5569,a person is facing towards a double-glass entrance door.
train/image/003854.jpg,309,a wall of shoes stand behind a person posing.
train/image/182872.jpg,14346,a picture frame and a stand that holds a dress are behind the posing person.
train/image/012146.jpg,978,"a person is posing in front of a wooden door which has a long, narrow window."
train/image/118433.jpg,9376,a shiny brown floor has a person posing and a bed in the background.
train/image/043394.jpg,3430,a lake and greenery stand in front of a person who is leaning on a railing.
train/image/149152.jpg,11700,a poster and a wire birdcage are behind the posing person.
train/image/012299.jpg,993,"an ornate archway, banner and patterned wallpaper are behind the person."
train/image/167791.jpg,13158,a purple rug with a person on it is on a tan floor.
train/image/046829.jpg,3694,a laptop keyboard on a desk is in front of the seated person.
train/image/083857.jpg,6615,a person poses near a blue towel.
train/image/182855.jpg,14346,in front of a mattress stands a person.
train/image/122438.jpg,9678,a person is standing on a red rug in a room.
train/image/032998.jpg,2594,a person sits on pink furniture covered with pillows.
